{
  "schemaVersion": "1.0.0",
  "states": [
    "draft",
    "evidence_collected",
    "policy_evaluated",
    "approval_pending",
    "approved",
    "action_authorized",
    "action_completed",
    "closed",
    "denied",
    "expired",
    "failed_recoverable",
    "failed_final",
    "needs_human_review",
    "replay_blocked"
  ],
  "transitions": {
    "draft": [
      "evidence_collected",
      "needs_human_review",
      "failed_recoverable",
      "failed_final"
    ],
    "evidence_collected": [
      "policy_evaluated",
      "needs_human_review",
      "failed_recoverable",
      "failed_final"
    ],
    "policy_evaluated": [
      "approval_pending",
      "approved",
      "denied",
      "needs_human_review",
      "failed_recoverable",
      "failed_final"
    ],
    "approval_pending": [
      "approved",
      "denied",
      "expired",
      "needs_human_review",
      "failed_recoverable",
      "failed_final"
    ],
    "approved": [
      "action_authorized",
      "denied",
      "expired",
      "needs_human_review",
      "failed_recoverable",
      "failed_final"
    ],
    "action_authorized": [
      "action_completed",
      "failed_recoverable",
      "failed_final",
      "needs_human_review",
      "replay_blocked"
    ],
    "action_completed": [
      "closed",
      "needs_human_review",
      "failed_final"
    ],
    "closed": [],
    "denied": [],
    "expired": [
      "needs_human_review",
      "failed_final"
    ],
    "failed_recoverable": [
      "evidence_collected",
      "policy_evaluated",
      "needs_human_review",
      "failed_final"
    ],
    "failed_final": [],
    "needs_human_review": [
      "policy_evaluated",
      "approval_pending",
      "denied",
      "closed",
      "failed_final"
    ],
    "replay_blocked": [
      "needs_human_review",
      "failed_final"
    ]
  },
  "safeCheckpoints": [
    "evidence_collected",
    "policy_evaluated",
    "approved"
  ]
}
